{
  "schema_version": "MONO_CI_A05_POSITIVE_ADD_C2_PROTOCOL_V2",
  "protocol_id": "MONO_CI_A05_POSITIVE_ADD_C2_PROTOCOL_V2",
  "classification": "TEST_ONLY_AUTHOR_DECLARED_DEVELOPMENT",
  "condition": "C2_ACTIVE_BOUNDED_RETAINS_AND_POSITIVE_ADD",
  "transition": {
    "before_state": "A0_4_REPORT_QUERY_PORT",
    "before_commit_sha": "d3101c0d3aa9b7b709253b6ec7518416f05f65b9",
    "after_state": "A0_5_MODULE_DATA_OWNERSHIP",
    "after_application_tree_sha": "007196f68652bc13f6798805793ffdfae96f95f7"
  },
  "method": {
    "id": "P_GOVERNED_ADAPTATION_DEVELOPMENT_V2_TEST_ONLY_EXACT_SET",
    "algorithm_changed": true,
    "image": "python:3.12.15-slim-bookworm@sha256:6a0e06f5ba0b373d051aabd3fffb9b873f27f9a2a3a14bcbe37dee6f0e3bbc70",
    "platform": "linux/amd64",
    "network": "none",
    "method_input_mount": "read-only",
    "writable_output_mounts": 1
  },
  "conditions": {
    "active_mandatory_test_only": [
      "AC_DATA_OWNERSHIP",
      "AC_MODULE_GRAPH",
      "AC_PUBLIC_API"
    ],
    "positive_add_target": "AC_DATA_OWNERSHIP",
    "retain_targets": [
      "AC_MODULE_GRAPH",
      "AC_PUBLIC_API"
    ],
    "all_other_catalog_applicability": "UNKNOWN",
    "independent_authority": false,
    "independent_semantic_validation": false
  },
  "repetitions": {
    "warmup": 1,
    "measured": 3
  },
  "cost_rule": {
    "unit": "elapsed wall-clock milliseconds per added evaluator invocation",
    "incremental_evaluator_id": "AC_DATA_OWNERSHIP",
    "fixed_max_incremental_cost_ms": 225,
    "max_search_nodes": 2,
    "source": "pinned V2_RELEASE_ASSET:analysis/evaluator-samples.csv",
    "source_sha256": "2bbff33702491cd0238271fa4c718316378586f5f7eb6af0271cf7baef25e7a7"
  },
  "measurements": [
    "actual_operation_plan",
    "final_governance_decision_and_reasons",
    "candidate_validation",
    "candidate_acceptance_or_rejection",
    "accepted_configuration_application_if_accepted",
    "clean_and_ownership_negative_detection",
    "incremental_evaluator_cost",
    "method_psi_execution_time",
    "full_transition_time"
  ],
  "stop_rule": "stop after failed preflight or first failed transition; preserve partial raw evidence",
  "official_boundary": {
    "study_readiness": "NO_GO",
    "measurement_status": "NOT_EXECUTED",
    "P_ALGORITHM_STATUS": "NOT_READY",
    "G1": "INCOMPLETE",
    "G4": "NOT_AUTHORIZED",
    "reference": "NOT_READY",
    "scoring": "NOT_EXECUTED"
  },
  "c1_recovery_reference": {
    "release": "https://github.com/Pan14ek/evofit-bench/releases/tag/mono-ci-a05-positive-add-recovery-40612830900-1",
    "archive_sha256": "3c3aaaa0ab675ec33158cebba9eae565bacab973a09e98ba5e48273952c760a2",
    "original_workflow_run": "https://github.com/Pan14ek/evofit-bench/actions/runs/40612830900",
    "original_workflow_conclusion": "FAILURE"
  },
  "c0_reference": {
    "study_id": "MONO_CI_B0_PSI_DELTA_A5_OWNER_AUTHORIZED_DEV_V2",
    "workflow_run": "https://github.com/Pan14ek/evofit-bench/actions/runs/40579333932",
    "release": "https://github.com/Pan14ek/evofit-bench/releases/tag/mono-ci-psi-a05-owner-authorized-v2-40579333932-1",
    "release_archive_sha256": "ef44cf280807e414b4027d846a8db05de74b555c60803500a97d074b666db0d2",
    "results_path": "experiments/execution/mono-ci-b0-psi-delta-a5-owner-authorized-v2/analysis/OWNER_AUTHORIZED_RESULTS_UK_V2.md",
    "transition_summary": {
      "warmup": 1,
      "measured": 3,
      "decision": "HOLD",
      "operations": [],
      "candidate_state": "MATERIALIZED_UNAPPLIED"
    }
  },
  "exact_set_closure": {
    "mode": "EXACT_SELECTED_OBLIGATIONS_ONLY",
    "selected_obligation_ids": [
      "AC_DATA_OWNERSHIP",
      "AC_MODULE_GRAPH",
      "AC_PUBLIC_API"
    ],
    "per_state_claims_per_obligation": 1,
    "universal_or_family_closure": false,
    "outside_scope_applicability": "UNKNOWN",
    "test_only_author_declared": true
  }
}
